{
  "run_id": "2026-07-07T06__L2-form-extension-basic__cb1b73d",
  "case_id": "L2-form-extension-basic",
  "tier": 2,
  "timestamp": "2026-07-07T06:21:24.971Z",
  "server_git_sha": "cb1b73d",
  "generated_artifacts": [
    "CustGroupFormExt.actual.xml"
  ],
  "build": {
    "succeeded": true,
    "errors": [],
    "bpWarnings": []
  },
  "golden_diff": {
    "matched": false,
    "missing": [
      "AxFormExtension/Controls/AxFormExtensionControl[Grid_PFXHasNotes]/FormControl[Grid_PFXHasNotes]/@type",
      "AxFormExtension/Controls/AxFormExtensionControl[Grid_PFXHasNotes]/FormControl[Grid_PFXHasNotes]/DataField",
      "AxFormExtension/Controls/AxFormExtensionControl[Grid_PFXHasNotes]/FormControl[Grid_PFXHasNotes]/DataSource",
      "AxFormExtension/Controls/AxFormExtensionControl[Grid_PFXHasNotes]/FormControl[Grid_PFXHasNotes]/FormControlExtension/@nil",
      "AxFormExtension/Controls/AxFormExtensionControl[Grid_PFXHasNotes]/FormControl[Grid_PFXHasNotes]/Name",
      "AxFormExtension/Controls/AxFormExtensionControl[Grid_PFXHasNotes]/FormControl[Grid_PFXHasNotes]/Type",
      "AxFormExtension/Controls/AxFormExtensionControl[Grid_PFXHasNotes]/Parent"
    ],
    "extra": [
      "AxFormExtension/Controls/AxFormExtensionControl[Grid_ConHasNotes]/FormControl[Grid_ConHasNotes]/@type",
      "AxFormExtension/Controls/AxFormExtensionControl[Grid_ConHasNotes]/FormControl[Grid_ConHasNotes]/DataField",
      "AxFormExtension/Controls/AxFormExtensionControl[Grid_ConHasNotes]/FormControl[Grid_ConHasNotes]/DataSource",
      "AxFormExtension/Controls/AxFormExtensionControl[Grid_ConHasNotes]/FormControl[Grid_ConHasNotes]/FormControlExtension/@nil",
      "AxFormExtension/Controls/AxFormExtensionControl[Grid_ConHasNotes]/FormControl[Grid_ConHasNotes]/Name",
      "AxFormExtension/Controls/AxFormExtensionControl[Grid_ConHasNotes]/FormControl[Grid_ConHasNotes]/Type",
      "AxFormExtension/Controls/AxFormExtensionControl[Grid_ConHasNotes]/Parent"
    ],
    "changed": []
  },
  "systest": {
    "ran": false,
    "passed": null,
    "failures": []
  },
  "score": {
    "build": 1,
    "bp_clean": 1,
    "golden_match": 0,
    "systest": null,
    "tier_weight": 2
  },
  "classification": "TOOL_DEFECT"
}
